{
  "schema_version": "marking_result.v1",
  "created_at": "2026-04-11T08:26:00.296168Z",
  "updated_at": "2026-04-11T08:26:00.296168Z",
  "context": {
    "student_id": "winston",
    "student_name": "Winston",
    "subject_context": "singapore_primary_english",
    "attempt_file_id": "f6fc1eef-3fc3-4a32-a7d0-226e9bb13e06",
    "attempt_file_path": "GOODNOTES_ROOT/Singapore Primary English/<student_email>/PSLE/Book/English Practice 1000/c_EPO_Vocabulary_Cloze_01.pdf",
    "template_file_id": "0ac101db-4314-4022-b03d-4f7b97083510",
    "template_file_path": "DAYDREAMEDU_ROOT/Singapore Primary English/PSLE/Book/English Practice 1000/_c_EPO_Vocabulary_Cloze_01.pdf",
    "book_group_id": "2d4cda5a-e0dd-46d7-a5fd-62aa2be30829",
    "book_label": "English Practice 1000",
    "unit_file_id": "0ac101db-4314-4022-b03d-4f7b97083510",
    "unit_file_path": "DAYDREAMEDU_ROOT/Singapore Primary English/PSLE/Book/English Practice 1000/_c_EPO_Vocabulary_Cloze_01.pdf",
    "unit_label": "EPO_Vocabulary_Cloze_01",
    "answer_file_id": "44ad5e11-d1fd-4b77-b8f5-9234f806ef0a",
    "answer_file_path": "DAYDREAMEDU_ROOT/Singapore Primary English/PSLE/Book/English Practice 1000/_c_EPO_Answers.pdf",
    "answer_page_start": 2,
    "answer_page_end": 2,
    "starts_mid_page": false,
    "ends_mid_page": false,
    "answer_mapping_source": "gemini_page_segments_ground_truth",
    "answer_mapping_notes": "Practice 031 appears within answer page 2, between earlier and later practices on the same page.",
    "question_selection": {
      "raw_text": null,
      "canonical_refs": [],
      "section_hint": null
    }
  },
  "summary": {
    "total_marks": 5,
    "earned_marks": 4,
    "percentage": 80.0,
    "overall_assessment": "Winston read the cloze passage carefully and got four items right. His only miss was on Q1, where `mystifying` fit the underlined word `mysterious` better than `puzzling` in this context.",
    "human_note": null
  },
  "question_results": [
    {
      "result_id": "Q1",
      "max_marks": 1,
      "earned_marks": 0,
      "outcome": "wrong",
      "student_answer": "(3)",
      "correct_answer": "(4)",
      "scoring_status": "counted",
      "feedback": null,
      "error_tags": [],
      "skill_tags": [
        "Vocabulary",
        "synonym choice",
        "mysterious -",
        "mystifying"
      ],
      "diagnosis": {
        "mistake_type": null,
        "reasoning": null,
        "confidence": null
      },
      "human_note": null
    },
    {
      "result_id": "Q2",
      "max_marks": 1,
      "earned_marks": 1,
      "outcome": "correct",
      "student_answer": "(4)",
      "correct_answer": "(4)",
      "scoring_status": "counted",
      "feedback": null,
      "error_tags": [],
      "skill_tags": [
        "Vocabulary",
        "mountain climbing",
        "problems -",
        "difficulties"
      ],
      "diagnosis": {
        "mistake_type": null,
        "reasoning": null,
        "confidence": null
      },
      "human_note": null
    },
    {
      "result_id": "Q3",
      "max_marks": 1,
      "earned_marks": 1,
      "outcome": "correct",
      "student_answer": "(3)",
      "correct_answer": "(3)",
      "scoring_status": "counted",
      "feedback": null,
      "error_tags": [],
      "skill_tags": [
        "Vocabulary",
        "achievement",
        "greatest -",
        "ultimate"
      ],
      "diagnosis": {
        "mistake_type": null,
        "reasoning": null,
        "confidence": null
      },
      "human_note": null
    },
    {
      "result_id": "Q4",
      "max_marks": 1,
      "earned_marks": 1,
      "outcome": "correct",
      "student_answer": "(1)",
      "correct_answer": "(1)",
      "scoring_status": "counted",
      "feedback": null,
      "error_tags": [],
      "skill_tags": [
        "Vocabulary",
        "scenery",
        "view -",
        "sight"
      ],
      "diagnosis": {
        "mistake_type": null,
        "reasoning": null,
        "confidence": null
      },
      "human_note": null
    },
    {
      "result_id": "Q5",
      "max_marks": 1,
      "earned_marks": 1,
      "outcome": "correct",
      "student_answer": "(3)",
      "correct_answer": "(3)",
      "scoring_status": "counted",
      "feedback": null,
      "error_tags": [],
      "skill_tags": [
        "Vocabulary",
        "motivation",
        "inspire -",
        "motivate"
      ],
      "diagnosis": {
        "mistake_type": null,
        "reasoning": null,
        "confidence": null
      },
      "human_note": null
    }
  ],
  "review_meta": {
    "updated_at": null,
    "updated_by": null
  },
  "generation": {
    "produced_by": "migrate_learning_reports",
    "mode": "migration_from_legacy_markdown",
    "notes": "Migrated from legacy markdown learning report."
  }
}
