{
  "schema_version": "marking_result.v1",
  "created_at": "2026-04-19T12:35:39Z",
  "updated_at": "2026-04-19T12:35:39Z",
  "context": {
    "student_id": "winston",
    "student_name": "Winston",
    "subject_context": "singapore_primary_english",
    "attempt_file_id": "e6a70ab4-93f8-4539-9e34-8e6636dd52e0",
    "attempt_file_path": "GOODNOTES_ROOT/Singapore Primary English/<student_email>/PSLE/Book/English Practice 1000/c_EPO_Comprehension_Cloze_09.pdf",
    "template_file_id": "2881ffcb-0aa2-4123-8f75-19aa36641278",
    "template_file_path": "DAYDREAMEDU_ROOT/Singapore Primary English/PSLE/Book/English Practice 1000/_c_EPO_Comprehension_Cloze_09.pdf",
    "book_group_id": "2d4cda5a-e0dd-46d7-a5fd-62aa2be30829",
    "book_label": "English Practice 1000",
    "unit_file_id": "2881ffcb-0aa2-4123-8f75-19aa36641278",
    "unit_file_path": "DAYDREAMEDU_ROOT/Singapore Primary English/PSLE/Book/English Practice 1000/_c_EPO_Comprehension_Cloze_09.pdf",
    "unit_label": "Comprehension_Cloze_09",
    "answer_file_id": "44ad5e11-d1fd-4b77-b8f5-9234f806ef0a",
    "answer_file_path": "DAYDREAMEDU_ROOT/Singapore Primary English/PSLE/Book/English Practice 1000/_c_EPO_Answers.pdf",
    "answer_page_start": 6,
    "answer_page_end": 6,
    "starts_mid_page": true,
    "ends_mid_page": true,
    "answer_mapping_source": "gemini_page_segments_ground_truth",
    "answer_mapping_notes": "Practice 099 appears within answer page 6, between earlier and later practices on the same page.",
    "question_selection": {
      "raw_text": null,
      "canonical_refs": [],
      "section_hint": null
    }
  },
  "summary": {
    "total_marks": 15,
    "earned_marks": 7,
    "percentage": 46.67,
    "overall_assessment": "Winston had several strong matches (fairy tale, countries, split, similar, Christmas time, portions, common). Weaker items included non-standard wording for shortages, the reunification line, and stew preparation vocabulary.",
    "human_note": null
  },
  "question_results": [
    {
      "result_id": "Q1",
      "max_marks": 1,
      "earned_marks": 1,
      "outcome": "correct",
      "student_answer": "fairy",
      "correct_answer": "fairy",
      "scoring_status": "counted",
      "feedback": null,
      "error_tags": [],
      "skill_tags": [],
      "diagnosis": {
        "mistake_type": null,
        "reasoning": null,
        "confidence": null
      },
      "human_note": null
    },
    {
      "result_id": "Q2",
      "max_marks": 1,
      "earned_marks": 0,
      "outcome": "wrong",
      "student_answer": "lived",
      "correct_answer": "discovered/found",
      "scoring_status": "counted",
      "feedback": null,
      "error_tags": [
        "vocabulary_gap"
      ],
      "skill_tags": [],
      "diagnosis": {
        "mistake_type": "vocabulary_gap",
        "reasoning": "The key expects \u201cdiscovered/found\u201d a gingerbread house; \u201clived\u201d breaks grammar and meaning.",
        "confidence": "medium"
      },
      "human_note": null
    },
    {
      "result_id": "Q3",
      "max_marks": 1,
      "earned_marks": 0,
      "outcome": "wrong",
      "student_answer": "necessity",
      "correct_answer": "staple",
      "scoring_status": "counted",
      "feedback": null,
      "error_tags": [
        "vocabulary_gap"
      ],
      "skill_tags": [],
      "diagnosis": {
        "mistake_type": "vocabulary_gap",
        "reasoning": "Potatoes are a dietary staple; \u201cnecessity\u201d is a different abstract noun.",
        "confidence": "medium"
      },
      "human_note": null
    },
    {
      "result_id": "Q4",
      "max_marks": 1,
      "earned_marks": 0,
      "outcome": "wrong",
      "student_answer": "decreasion",
      "correct_answer": "shortages",
      "scoring_status": "counted",
      "feedback": null,
      "error_tags": [
        "vocabulary_gap"
      ],
      "skill_tags": [],
      "diagnosis": {
        "mistake_type": "vocabulary_gap",
        "reasoning": "Wars cause food shortages; the student word is not standard English and does not match the key.",
        "confidence": "medium"
      },
      "human_note": null
    },
    {
      "result_id": "Q5",
      "max_marks": 1,
      "earned_marks": 0,
      "outcome": "wrong",
      "student_answer": "gone",
      "correct_answer": "scarce",
      "scoring_status": "counted",
      "feedback": null,
      "error_tags": [
        "vocabulary_gap"
      ],
      "skill_tags": [],
      "diagnosis": {
        "mistake_type": "vocabulary_gap",
        "reasoning": "Food was scarce after WWI; \u201cgone\u201d is too absolute compared to the keyed sense.",
        "confidence": "medium"
      },
      "human_note": null
    },
    {
      "result_id": "Q6",
      "max_marks": 1,
      "earned_marks": 1,
      "outcome": "correct",
      "student_answer": "countries",
      "correct_answer": "nations/countries",
      "scoring_status": "counted",
      "feedback": null,
      "error_tags": [],
      "skill_tags": [],
      "diagnosis": {
        "mistake_type": null,
        "reasoning": null,
        "confidence": null
      },
      "human_note": null
    },
    {
      "result_id": "Q7",
      "max_marks": 1,
      "earned_marks": 1,
      "outcome": "correct",
      "student_answer": "split",
      "correct_answer": "divided",
      "scoring_status": "counted",
      "feedback": null,
      "error_tags": [],
      "skill_tags": [],
      "diagnosis": {
        "mistake_type": null,
        "reasoning": null,
        "confidence": null
      },
      "human_note": null
    },
    {
      "result_id": "Q8",
      "max_marks": 1,
      "earned_marks": 0,
      "outcome": "wrong",
      "student_answer": "adapt",
      "correct_answer": "develop/cultivate",
      "scoring_status": "counted",
      "feedback": null,
      "error_tags": [
        "vocabulary_gap"
      ],
      "skill_tags": [],
      "diagnosis": {
        "mistake_type": "vocabulary_gap",
        "reasoning": "The regions developed/cultivated different cooking styles; \u201cadapt\u201d does not match the keyed verb.",
        "confidence": "medium"
      },
      "human_note": null
    },
    {
      "result_id": "Q9",
      "max_marks": 1,
      "earned_marks": 0,
      "outcome": "wrong",
      "student_answer": "named",
      "correct_answer": "known",
      "scoring_status": "counted",
      "feedback": null,
      "error_tags": [
        "vocabulary_gap"
      ],
      "skill_tags": [],
      "diagnosis": {
        "mistake_type": "vocabulary_gap",
        "reasoning": "The sausage is known as W\u00fcstchen; \u201cnamed\u201d is close but not the keyed word.",
        "confidence": "medium"
      },
      "human_note": null
    },
    {
      "result_id": "Q10",
      "max_marks": 1,
      "earned_marks": 1,
      "outcome": "correct",
      "student_answer": "similar",
      "correct_answer": "similar",
      "scoring_status": "counted",
      "feedback": null,
      "error_tags": [],
      "skill_tags": [],
      "diagnosis": {
        "mistake_type": null,
        "reasoning": null,
        "confidence": null
      },
      "human_note": null
    },
    {
      "result_id": "Q11",
      "max_marks": 1,
      "earned_marks": 1,
      "outcome": "correct",
      "student_answer": "time",
      "correct_answer": "season/period",
      "scoring_status": "counted",
      "feedback": null,
      "error_tags": [],
      "skill_tags": [],
      "diagnosis": {
        "mistake_type": null,
        "reasoning": null,
        "confidence": null
      },
      "human_note": null
    },
    {
      "result_id": "Q12",
      "max_marks": 1,
      "earned_marks": 0,
      "outcome": "wrong",
      "student_answer": "declared",
      "correct_answer": "reunited",
      "scoring_status": "counted",
      "feedback": null,
      "error_tags": [
        "vocabulary_gap"
      ],
      "skill_tags": [],
      "diagnosis": {
        "mistake_type": "vocabulary_gap",
        "reasoning": "East and West Germany reunified in 1990; \u201cdeclared\u201d suggests a different (incorrect) event.",
        "confidence": "medium"
      },
      "human_note": null
    },
    {
      "result_id": "Q13",
      "max_marks": 1,
      "earned_marks": 1,
      "outcome": "correct",
      "student_answer": "portions",
      "correct_answer": "portions/servings",
      "scoring_status": "counted",
      "feedback": null,
      "error_tags": [],
      "skill_tags": [],
      "diagnosis": {
        "mistake_type": null,
        "reasoning": null,
        "confidence": null
      },
      "human_note": null
    },
    {
      "result_id": "Q14",
      "max_marks": 1,
      "earned_marks": 0,
      "outcome": "wrong",
      "student_answer": "brew",
      "correct_answer": "prepare/cook",
      "scoring_status": "counted",
      "feedback": null,
      "error_tags": [
        "vocabulary_gap"
      ],
      "skill_tags": [],
      "diagnosis": {
        "mistake_type": "vocabulary_gap",
        "reasoning": "The stew is prepared/cooked; \u201cbrew\u201d usually collocates with drinks, not stew.",
        "confidence": "medium"
      },
      "human_note": null
    },
    {
      "result_id": "Q15",
      "max_marks": 1,
      "earned_marks": 1,
      "outcome": "correct",
      "student_answer": "common",
      "correct_answer": "common",
      "scoring_status": "counted",
      "feedback": null,
      "error_tags": [],
      "skill_tags": [],
      "diagnosis": {
        "mistake_type": null,
        "reasoning": null,
        "confidence": null
      },
      "human_note": null
    }
  ],
  "review_meta": {
    "updated_at": null,
    "updated_by": null
  },
  "generation": {
    "produced_by": "manual_visual_marking",
    "mode": "goodnotes_completion",
    "notes": "Practice 099 (Comprehension Cloze 09); answer key verified on _c_EPO_Answers.pdf page 6 (Practice 9 block)."
  }
}
