{
  "schema_version": "marking_result.v1",
  "created_at": "2026-04-13T05:52:18.893501Z",
  "updated_at": "2026-04-13T05:52:18.893501Z",
  "context": {
    "student_id": "winston",
    "student_name": "Winston",
    "subject_context": "singapore_primary_math",
    "attempt_file_id": "b42099ac-42ea-4b5f-a7b5-8ca2becdd41d",
    "attempt_file_path": "/Users/jarodm/Library/CloudStorage/GoogleDrive-genrong.meng@gmail.com/My Drive/GoodNotes/Singapore Primary Math/winston.ry.meng@gmail.com/P6/Book/Model Drawing Made Easy and Inspiring for P5 and P6/c_Math Model P5 and P6_037_Unit 2 - 16 - Review 4 (attempt).pdf",
    "template_file_id": "fa1a7b67-159a-4c14-bcc3-68f68ecd06e5",
    "template_file_path": "/Users/jarodm/Library/CloudStorage/GoogleDrive-genrong.meng@gmail.com/My Drive/DaydreamEdu/Singapore Primary Math/P6/Book/Model Drawing Made Easy and Inspiring for P5 and P6/_c_Math Model P5 and P6_037_Unit 2 - 16 - Review 4.pdf",
    "book_group_id": "e887fae1-f787-4cc8-bb2b-d0dfbe8eba4b",
    "book_label": "Model Drawing Made Easy and Inspiring for P5 and P6",
    "unit_file_id": "fa1a7b67-159a-4c14-bcc3-68f68ecd06e5",
    "unit_file_path": "/Users/jarodm/Library/CloudStorage/GoogleDrive-genrong.meng@gmail.com/My Drive/DaydreamEdu/Singapore Primary Math/P6/Book/Model Drawing Made Easy and Inspiring for P5 and P6/_c_Math Model P5 and P6_037_Unit 2 - 16 - Review 4.pdf",
    "unit_label": "Math Model P5 and P6_037_Unit 2 - 16 - Review 4",
    "answer_file_id": "9e5797e2-5572-40bb-8a77-dd0336577820",
    "answer_file_path": "/Users/jarodm/Library/CloudStorage/GoogleDrive-genrong.meng@gmail.com/My Drive/DaydreamEdu/Singapore Primary Math/P6/Book/Model Drawing Made Easy and Inspiring for P5 and P6/_c_Math Model P5 and P6 Worked Solutions.pdf",
    "answer_page_start": 31,
    "answer_page_end": 33,
    "starts_mid_page": false,
    "ends_mid_page": false,
    "answer_mapping_source": "Found on linked template file (not directly on completion): attempt24_full_human_verified_2026-04-13",
    "answer_mapping_notes": null,
    "question_selection": {
      "raw_text": null,
      "canonical_refs": [],
      "section_hint": null
    }
  },
  "summary": {
    "total_marks": 12,
    "earned_marks": 7,
    "percentage": 58.33,
    "overall_assessment": "Winston solves most fraction model-drawing items correctly, especially Questions 1, 2, 4, 5, 8, and 10. The main gaps are multi-step remainder interpretation (Questions 3, 6, 7, 9), where unit/part relationships and final comparison statements need more care.",
    "human_note": null
  },
  "question_results": [
    {
      "result_id": "Q1",
      "max_marks": 1,
      "earned_marks": 1,
      "outcome": "correct",
      "student_answer": "519",
      "correct_answer": "519",
      "scoring_status": "counted",
      "feedback": null,
      "error_tags": [],
      "skill_tags": [
        "Model drawing",
        "fractions of a whole",
        "remainder and comparison"
      ],
      "diagnosis": {
        "mistake_type": null,
        "reasoning": null,
        "confidence": null
      },
      "human_note": null
    },
    {
      "result_id": "Q2(a)",
      "max_marks": 1,
      "earned_marks": 1,
      "outcome": "correct",
      "student_answer": "4340",
      "correct_answer": "4340",
      "scoring_status": "counted",
      "feedback": null,
      "error_tags": [],
      "skill_tags": [
        "Model drawing",
        "salary fractions",
        "unit value"
      ],
      "diagnosis": {
        "mistake_type": null,
        "reasoning": null,
        "confidence": null
      },
      "human_note": null
    },
    {
      "result_id": "Q2(b)",
      "max_marks": 1,
      "earned_marks": 1,
      "outcome": "correct",
      "student_answer": "4/31",
      "correct_answer": "4/31",
      "scoring_status": "counted",
      "feedback": null,
      "error_tags": [],
      "skill_tags": [
        "Model drawing",
        "salary fractions",
        "fraction of total"
      ],
      "diagnosis": {
        "mistake_type": null,
        "reasoning": null,
        "confidence": null
      },
      "human_note": null
    },
    {
      "result_id": "Q3",
      "max_marks": 1,
      "earned_marks": 0,
      "outcome": "wrong",
      "student_answer": "240",
      "correct_answer": "200",
      "scoring_status": "counted",
      "feedback": null,
      "error_tags": [],
      "skill_tags": [
        "Model drawing",
        "nested fractions",
        "remainder conversion"
      ],
      "diagnosis": {
        "mistake_type": null,
        "reasoning": null,
        "confidence": null
      },
      "human_note": null
    },
    {
      "result_id": "Q4",
      "max_marks": 1,
      "earned_marks": 1,
      "outcome": "correct",
      "student_answer": "11/38",
      "correct_answer": "11/38",
      "scoring_status": "counted",
      "feedback": null,
      "error_tags": [],
      "skill_tags": [
        "Model drawing",
        "sold fraction",
        "reconstruct total"
      ],
      "diagnosis": {
        "mistake_type": null,
        "reasoning": null,
        "confidence": null
      },
      "human_note": null
    },
    {
      "result_id": "Q5",
      "max_marks": 1,
      "earned_marks": 1,
      "outcome": "correct",
      "student_answer": "$7.84",
      "correct_answer": "$7.84",
      "scoring_status": "counted",
      "feedback": null,
      "error_tags": [],
      "skill_tags": [
        "Model drawing",
        "spending fractions",
        "convert remaining amount"
      ],
      "diagnosis": {
        "mistake_type": null,
        "reasoning": null,
        "confidence": null
      },
      "human_note": null
    },
    {
      "result_id": "Q6",
      "max_marks": 1,
      "earned_marks": 0,
      "outcome": "wrong",
      "student_answer": "146.2",
      "correct_answer": "258",
      "scoring_status": "counted",
      "feedback": null,
      "error_tags": [],
      "skill_tags": [
        "Model drawing",
        "mixed-number ratio",
        "adults vs children difference"
      ],
      "diagnosis": {
        "mistake_type": null,
        "reasoning": null,
        "confidence": null
      },
      "human_note": null
    },
    {
      "result_id": "Q7(a)",
      "max_marks": 1,
      "earned_marks": 0,
      "outcome": "wrong",
      "student_answer": "60",
      "correct_answer": "12",
      "scoring_status": "counted",
      "feedback": null,
      "error_tags": [],
      "skill_tags": [
        "Model drawing",
        "parts and remainder",
        "find one unit"
      ],
      "diagnosis": {
        "mistake_type": null,
        "reasoning": null,
        "confidence": null
      },
      "human_note": null
    },
    {
      "result_id": "Q7(b)",
      "max_marks": 1,
      "earned_marks": 0,
      "outcome": "wrong",
      "student_answer": "2/3",
      "correct_answer": "3/5",
      "scoring_status": "counted",
      "feedback": null,
      "error_tags": [],
      "skill_tags": [
        "Model drawing",
        "blue vs yellow",
        "fraction comparison"
      ],
      "diagnosis": {
        "mistake_type": null,
        "reasoning": null,
        "confidence": null
      },
      "human_note": null
    },
    {
      "result_id": "Q8",
      "max_marks": 1,
      "earned_marks": 1,
      "outcome": "correct",
      "student_answer": "23",
      "correct_answer": "23",
      "scoring_status": "counted",
      "feedback": null,
      "error_tags": [],
      "skill_tags": [
        "Model drawing",
        "girls and boys",
        "excess over fraction"
      ],
      "diagnosis": {
        "mistake_type": null,
        "reasoning": null,
        "confidence": null
      },
      "human_note": null
    },
    {
      "result_id": "Q9",
      "max_marks": 1,
      "earned_marks": 0,
      "outcome": "wrong",
      "student_answer": "267",
      "correct_answer": "262",
      "scoring_status": "counted",
      "feedback": null,
      "error_tags": [],
      "skill_tags": [
        "Model drawing",
        "after transfer",
        "reverse to original difference"
      ],
      "diagnosis": {
        "mistake_type": null,
        "reasoning": null,
        "confidence": null
      },
      "human_note": null
    },
    {
      "result_id": "Q10",
      "max_marks": 1,
      "earned_marks": 1,
      "outcome": "correct",
      "student_answer": "9/29",
      "correct_answer": "9/29",
      "scoring_status": "counted",
      "feedback": null,
      "error_tags": [],
      "skill_tags": [
        "Model drawing",
        "combined fractions",
        "total spent over total initial"
      ],
      "diagnosis": {
        "mistake_type": null,
        "reasoning": null,
        "confidence": null
      },
      "human_note": null
    }
  ],
  "review_meta": {
    "updated_at": null,
    "updated_by": null
  },
  "generation": {
    "produced_by": "migrate_learning_reports",
    "mode": "migration_from_legacy_markdown",
    "notes": "Migrated from legacy markdown learning report."
  }
}
