{
  "schema_version": "marking_result.v1",
  "created_at": "2026-04-16T12:14:27.028365Z",
  "updated_at": "2026-04-16T12:14:27.028365Z",
  "context": {
    "student_id": "emma",
    "student_name": null,
    "subject_context": "singapore_primary_english",
    "attempt_file_id": "fc6d7800-aa38-41b7-9237-e24325a69f41",
    "attempt_file_path": "GOODNOTES_ROOT/Singapore Primary English/<student_email>/P4/Book/Conquer English Synthesis and Transformation Primary 4/c_Conquer English Synthesis and Transformation Primary 4 - 02 Exercise 2.pdf",
    "template_file_id": "a49b5ebd-bfc4-492d-b37a-1ffbc8fe02aa",
    "template_file_path": "DAYDREAMEDU_ROOT/Singapore Primary English/P4/Book/Conquer English Synthesis and Transformation Primary 4/_c_Conquer English Synthesis and Transformation Primary 4 - 02 Exercise 2.pdf",
    "book_group_id": "fbec8ba0-85b9-462b-8cb9-b65c5280dfb0",
    "book_label": "Conquer English Synthesis and Transformation Primary 4",
    "unit_file_id": "a49b5ebd-bfc4-492d-b37a-1ffbc8fe02aa",
    "unit_file_path": "DAYDREAMEDU_ROOT/Singapore Primary English/P4/Book/Conquer English Synthesis and Transformation Primary 4/_c_Conquer English Synthesis and Transformation Primary 4 - 02 Exercise 2.pdf",
    "unit_label": "02 Exercise 2",
    "answer_file_id": "451d78fb-62e3-49e5-87b4-60a14fa33464",
    "answer_file_path": "DAYDREAMEDU_ROOT/Singapore Primary English/P4/Book/Conquer English Synthesis and Transformation Primary 4/_c_Conquer English Synthesis and Transformation Primary 4 - 071 Answers.pdf",
    "answer_page_start": 2,
    "answer_page_end": 2,
    "starts_mid_page": true,
    "ends_mid_page": true,
    "answer_mapping_source": "ground_truth_conquer_english_synthesis_transformation_primary_4_v01",
    "answer_mapping_notes": null,
    "question_selection": {
      "raw_text": null,
      "canonical_refs": [],
      "section_hint": null
    }
  },
  "summary": {
    "total_marks": 10,
    "earned_marks": 10,
    "percentage": 100.0,
    "overall_assessment": "Excellent work: all ten 'until' sentences convey the correct meaning with natural phrasing.",
    "human_note": null
  },
  "question_results": [
    {
      "result_id": "Q1",
      "max_marks": 1,
      "earned_marks": 1,
      "outcome": "correct",
      "student_answer": "The detectives continued investigating the case until they solved the case.",
      "correct_answer": "The detectives continued investigating the case until they solved the case.",
      "scoring_status": "counted",
      "feedback": "Good sentence with correct use of 'until'.",
      "error_tags": [],
      "skill_tags": [
        "Grammar > connectors > until"
      ],
      "diagnosis": {
        "mistake_type": null,
        "reasoning": "Student's sentence meaning matches the model answer and uses 'until' correctly.",
        "confidence": "high"
      },
      "human_note": null
    },
    {
      "result_id": "Q2",
      "max_marks": 1,
      "earned_marks": 1,
      "outcome": "correct",
      "student_answer": "We waited at the bus shelter until the rain stopped.",
      "correct_answer": "We waited at the bus shelter until the rain stopped.",
      "scoring_status": "counted",
      "feedback": "Good sentence with correct use of 'until'.",
      "error_tags": [],
      "skill_tags": [
        "Grammar > connectors > until"
      ],
      "diagnosis": {
        "mistake_type": null,
        "reasoning": "Student's sentence meaning matches the model answer and uses 'until' correctly.",
        "confidence": "high"
      },
      "human_note": null
    },
    {
      "result_id": "Q3",
      "max_marks": 1,
      "earned_marks": 1,
      "outcome": "correct",
      "student_answer": "The victim struggled until she broke free from her kidnapper.",
      "correct_answer": "The victim struggled until she broke free from her kidnapper.",
      "scoring_status": "counted",
      "feedback": "Good sentence with correct use of 'until'.",
      "error_tags": [],
      "skill_tags": [
        "Grammar > connectors > until"
      ],
      "diagnosis": {
        "mistake_type": null,
        "reasoning": "Student's sentence meaning matches the model answer and uses 'until' correctly.",
        "confidence": "high"
      },
      "human_note": null
    },
    {
      "result_id": "Q4",
      "max_marks": 1,
      "earned_marks": 1,
      "outcome": "correct",
      "student_answer": "She refused to talk to me until I apologised to her.",
      "correct_answer": "She refused to talk to me until I apologised to her.",
      "scoring_status": "counted",
      "feedback": "Good sentence with correct use of 'until'.",
      "error_tags": [],
      "skill_tags": [
        "Grammar > connectors > until"
      ],
      "diagnosis": {
        "mistake_type": null,
        "reasoning": "Student's sentence meaning matches the model answer and uses 'until' correctly.",
        "confidence": "high"
      },
      "human_note": null
    },
    {
      "result_id": "Q5",
      "max_marks": 1,
      "earned_marks": 1,
      "outcome": "correct",
      "student_answer": "I waited in school until my mother came to pick me up.",
      "correct_answer": "I waited in school until my mother came to pick me up.",
      "scoring_status": "counted",
      "feedback": "Good sentence with correct use of 'until'.",
      "error_tags": [],
      "skill_tags": [
        "Grammar > connectors > until"
      ],
      "diagnosis": {
        "mistake_type": null,
        "reasoning": "Student's sentence meaning matches the model answer and uses 'until' correctly.",
        "confidence": "high"
      },
      "human_note": null
    },
    {
      "result_id": "Q6",
      "max_marks": 1,
      "earned_marks": 1,
      "outcome": "correct",
      "student_answer": "The runners ran as fast as they could until they reached the finishing line.",
      "correct_answer": "The runners ran as fast as they could until they reached the finishing line.",
      "scoring_status": "counted",
      "feedback": "Good sentence with correct use of 'until'.",
      "error_tags": [],
      "skill_tags": [
        "Grammar > connectors > until"
      ],
      "diagnosis": {
        "mistake_type": null,
        "reasoning": "Student's sentence meaning matches the model answer and uses 'until' correctly.",
        "confidence": "high"
      },
      "human_note": null
    },
    {
      "result_id": "Q7",
      "max_marks": 1,
      "earned_marks": 1,
      "outcome": "correct",
      "student_answer": "I waited at the porch until my father came home.",
      "correct_answer": "I waited at the porch until my father came home.",
      "scoring_status": "counted",
      "feedback": "Good sentence with correct use of 'until'.",
      "error_tags": [],
      "skill_tags": [
        "Grammar > connectors > until"
      ],
      "diagnosis": {
        "mistake_type": null,
        "reasoning": "Student's sentence meaning matches the model answer and uses 'until' correctly.",
        "confidence": "high"
      },
      "human_note": null
    },
    {
      "result_id": "Q8",
      "max_marks": 1,
      "earned_marks": 1,
      "outcome": "correct",
      "student_answer": "Linus did his homework until it was time for dinner.",
      "correct_answer": "Linus did his homework until it was time for dinner.",
      "scoring_status": "counted",
      "feedback": "Good sentence with correct use of 'until'.",
      "error_tags": [],
      "skill_tags": [
        "Grammar > connectors > until"
      ],
      "diagnosis": {
        "mistake_type": null,
        "reasoning": "Student's sentence meaning matches the model answer and uses 'until' correctly.",
        "confidence": "high"
      },
      "human_note": null
    },
    {
      "result_id": "Q9",
      "max_marks": 1,
      "earned_marks": 1,
      "outcome": "correct",
      "student_answer": "The vehicle that was involved in the accident remained on the road until the breakdown truck came to tow it away.",
      "correct_answer": "The vehicle that was involved in the accident remained on the road until the breakdown truck came to tow it away.",
      "scoring_status": "counted",
      "feedback": "Good sentence with correct use of 'until'.",
      "error_tags": [],
      "skill_tags": [
        "Grammar > connectors > until"
      ],
      "diagnosis": {
        "mistake_type": null,
        "reasoning": "Student's sentence meaning matches the model answer and uses 'until' correctly.",
        "confidence": "high"
      },
      "human_note": null
    },
    {
      "result_id": "Q10",
      "max_marks": 1,
      "earned_marks": 1,
      "outcome": "correct",
      "student_answer": "The children stayed in their tent until the bear was gone.",
      "correct_answer": "The children stayed in their tent until the bear was gone.",
      "scoring_status": "counted",
      "feedback": "Good sentence with correct use of 'until'.",
      "error_tags": [],
      "skill_tags": [
        "Grammar > connectors > until"
      ],
      "diagnosis": {
        "mistake_type": null,
        "reasoning": "Student's sentence meaning matches the model answer and uses 'until' correctly.",
        "confidence": "high"
      },
      "human_note": null
    }
  ],
  "review_meta": {
    "updated_at": null,
    "updated_by": null
  },
  "generation": {
    "produced_by": "cursor-agent",
    "mode": "manual-visual-marking",
    "notes": null
  }
}
