{
  "schema_version": "marking_result.v1",
  "created_at": "2026-04-13T09:27:00.770846Z",
  "updated_at": "2026-04-13T09:27:00.770846Z",
  "context": {
    "student_id": "winston",
    "student_name": "Winston",
    "subject_context": "singapore_primary_math",
    "attempt_file_id": "35c0a556-16c5-422e-a937-934e38567bc2",
    "attempt_file_path": "GOODNOTES_ROOT/Singapore Primary Math/<student_email>/P6/Book/Model Drawing Made Easy and Inspiring for P5 and P6/c_Math Model P5 and P6_059_Unit 4 - 01 - 4.1.pdf",
    "template_file_id": "171e6afb-e3de-4962-a4c0-a4bfbe9ec9f6",
    "template_file_path": "DAYDREAMEDU_ROOT/Singapore Primary Math/P6/Book/Model Drawing Made Easy and Inspiring for P5 and P6/_c_Math Model P5 and P6_059_Unit 4 - 01 - 4.1.pdf",
    "book_group_id": "e887fae1-f787-4cc8-bb2b-d0dfbe8eba4b",
    "book_label": "Model Drawing Made Easy and Inspiring for P5 and P6",
    "unit_file_id": "171e6afb-e3de-4962-a4c0-a4bfbe9ec9f6",
    "unit_file_path": "DAYDREAMEDU_ROOT/Singapore Primary Math/P6/Book/Model Drawing Made Easy and Inspiring for P5 and P6/_c_Math Model P5 and P6_059_Unit 4 - 01 - 4.1.pdf",
    "unit_label": "Math Model P5 and P6_059_Unit 4 - 01 - 4.1",
    "answer_file_id": "9e5797e2-5572-40bb-8a77-dd0336577820",
    "answer_file_path": "DAYDREAMEDU_ROOT/Singapore Primary Math/P6/Book/Model Drawing Made Easy and Inspiring for P5 and P6/_c_Math Model P5 and P6 Worked Solutions.pdf",
    "answer_page_start": 57,
    "answer_page_end": 58,
    "starts_mid_page": false,
    "ends_mid_page": false,
    "answer_mapping_source": "attempt24_full_human_verified_2026-04-13",
    "answer_mapping_notes": null,
    "question_selection": {
      "raw_text": null,
      "canonical_refs": [],
      "section_hint": null
    }
  },
  "summary": {
    "total_marks": 3,
    "earned_marks": 3,
    "percentage": 100.0,
    "overall_assessment": "Winston showed strong understanding across this practice and converted percentage/ratio relationships correctly in most questions.",
    "human_note": null
  },
  "question_results": [
    {
      "result_id": "Q1",
      "max_marks": 1,
      "earned_marks": 1,
      "outcome": "correct",
      "student_answer": "1900",
      "correct_answer": "1900",
      "scoring_status": "counted",
      "feedback": null,
      "error_tags": [],
      "skill_tags": [
        "Percentage",
        "whole from given percent",
        "45% to 100%"
      ],
      "diagnosis": {
        "mistake_type": null,
        "reasoning": null,
        "confidence": null
      },
      "human_note": null
    },
    {
      "result_id": "Q2",
      "max_marks": 1,
      "earned_marks": 1,
      "outcome": "correct",
      "student_answer": "45 m",
      "correct_answer": "45 m",
      "scoring_status": "counted",
      "feedback": null,
      "error_tags": [],
      "skill_tags": [
        "Percentage",
        "whole from given percent",
        "84% to 100%"
      ],
      "diagnosis": {
        "mistake_type": null,
        "reasoning": null,
        "confidence": null
      },
      "human_note": null
    },
    {
      "result_id": "Q3",
      "max_marks": 1,
      "earned_marks": 1,
      "outcome": "correct",
      "student_answer": "18",
      "correct_answer": "18",
      "scoring_status": "counted",
      "feedback": null,
      "error_tags": [],
      "skill_tags": [
        "Percentage",
        "difference from related whole",
        "compare 80% and 100%"
      ],
      "diagnosis": {
        "mistake_type": null,
        "reasoning": null,
        "confidence": null
      },
      "human_note": null
    }
  ],
  "review_meta": {
    "updated_at": null,
    "updated_by": null
  },
  "generation": {
    "produced_by": "migrate_learning_reports",
    "mode": "migration_from_legacy_markdown",
    "notes": "Migrated from legacy markdown learning report."
  }
}
