{
  "schema_version": "marking_result.v1",
  "created_at": "2026-04-13T00:40:47.157920Z",
  "updated_at": "2026-04-13T00:40:47.157920Z",
  "context": {
    "student_id": "winston",
    "student_name": "Winston",
    "subject_context": "singapore_primary_math",
    "attempt_file_id": "b77e4697-c518-40af-a7d8-6e7f0516babf",
    "attempt_file_path": "GOODNOTES_ROOT/Singapore Primary Math/<student_email>/P6/Book/Model Drawing Made Easy and Inspiring for P5 and P6/c_Math Model P5 and P6_060_Unit 4 - 02 - 4.2.pdf",
    "template_file_id": "16270723-4d9c-432e-a655-d15d1e5d9696",
    "template_file_path": "DAYDREAMEDU_ROOT/Singapore Primary Math/P6/Book/Model Drawing Made Easy and Inspiring for P5 and P6/_c_Math Model P5 and P6_060_Unit 4 - 02 - 4.2.pdf",
    "book_group_id": "e887fae1-f787-4cc8-bb2b-d0dfbe8eba4b",
    "book_label": "Model Drawing Made Easy and Inspiring for P5 and P6",
    "unit_file_id": "16270723-4d9c-432e-a655-d15d1e5d9696",
    "unit_file_path": "DAYDREAMEDU_ROOT/Singapore Primary Math/P6/Book/Model Drawing Made Easy and Inspiring for P5 and P6/_c_Math Model P5 and P6_060_Unit 4 - 02 - 4.2.pdf",
    "unit_label": "Math Model P5 and P6_060_Unit 4 - 02 - 4.2",
    "answer_file_id": "9e5797e2-5572-40bb-8a77-dd0336577820",
    "answer_file_path": "DAYDREAMEDU_ROOT/Singapore Primary Math/P6/Book/Model Drawing Made Easy and Inspiring for P5 and P6/_c_Math Model P5 and P6 Worked Solutions.pdf",
    "answer_page_start": 58,
    "answer_page_end": 58,
    "starts_mid_page": false,
    "ends_mid_page": false,
    "answer_mapping_source": "attempt24_full_human_verified_2026-04-13",
    "answer_mapping_notes": null,
    "question_selection": {
      "raw_text": null,
      "canonical_refs": [],
      "section_hint": null
    }
  },
  "summary": {
    "total_marks": 2,
    "earned_marks": 2,
    "percentage": 100.0,
    "overall_assessment": "Winston answered all gradable questions correctly. Q2 was disqualified from scoring due to a source mismatch between the question and mapped answer key.",
    "human_note": null
  },
  "question_results": [
    {
      "result_id": "Q1",
      "max_marks": 1,
      "earned_marks": 1,
      "outcome": "correct",
      "student_answer": "1500",
      "correct_answer": "1500",
      "scoring_status": "counted",
      "feedback": null,
      "error_tags": [],
      "skill_tags": [
        "Percentage",
        "composition of parts",
        "remaining percentage to whole"
      ],
      "diagnosis": {
        "mistake_type": null,
        "reasoning": null,
        "confidence": null
      },
      "human_note": null
    },
    {
      "result_id": "Q2",
      "max_marks": 0,
      "earned_marks": 0,
      "outcome": "disqualified",
      "student_answer": "612.5",
      "correct_answer": "N/A",
      "scoring_status": "excluded_disqualified",
      "feedback": null,
      "error_tags": [],
      "skill_tags": [],
      "diagnosis": {
        "mistake_type": null,
        "reasoning": null,
        "confidence": null
      },
      "human_note": null
    },
    {
      "result_id": "Q3",
      "max_marks": 1,
      "earned_marks": 1,
      "outcome": "correct",
      "student_answer": "$30",
      "correct_answer": "$30",
      "scoring_status": "counted",
      "feedback": null,
      "error_tags": [],
      "skill_tags": [
        "Percentage",
        "mixed fraction-percent deduction",
        "infer whole from remainder percent"
      ],
      "diagnosis": {
        "mistake_type": null,
        "reasoning": null,
        "confidence": null
      },
      "human_note": null
    }
  ],
  "review_meta": {
    "updated_at": null,
    "updated_by": null
  },
  "generation": {
    "produced_by": "migrate_learning_reports",
    "mode": "migration_from_legacy_markdown",
    "notes": "Migrated from legacy markdown learning report."
  }
}
