{
  "schema_version": "marking_result.v1",
  "created_at": "2026-04-11T02:20:05.296203Z",
  "updated_at": "2026-04-11T02:20:05.296203Z",
  "context": {
    "student_id": "emma",
    "student_name": "Emma",
    "subject_context": "singapore_primary_english",
    "attempt_file_id": "2f5d658c-565f-4138-abe8-76cad284f0b7",
    "attempt_file_path": "/Users/jarodm/Library/CloudStorage/GoogleDrive-genrong.meng@gmail.com/My Drive/GoodNotes/Singapore Primary English/emma.rs.meng@gmail.com/P4/Book/Conquer English Vocabulary Primary 4/c_Conquer English Vocabulary Primary 4 - 010 Exercise 010.pdf",
    "template_file_id": "ca7ddb78-a7a0-4915-9008-be8ec920eb23",
    "template_file_path": "/Users/jarodm/Library/CloudStorage/GoogleDrive-genrong.meng@gmail.com/My Drive/DaydreamEdu/Singapore Primary English/P4/Book/Conquer English Vocabulary Primary 4/_c_Conquer English Vocabulary Primary 4 - 010 Exercise 010.pdf",
    "book_group_id": "a777a5e9-653d-4c26-90f2-c3ab02db01e4",
    "book_label": "Conquer English Vocabulary Primary 4",
    "unit_file_id": "ca7ddb78-a7a0-4915-9008-be8ec920eb23",
    "unit_file_path": "/Users/jarodm/Library/CloudStorage/GoogleDrive-genrong.meng@gmail.com/My Drive/DaydreamEdu/Singapore Primary English/P4/Book/Conquer English Vocabulary Primary 4/_c_Conquer English Vocabulary Primary 4 - 010 Exercise 010.pdf",
    "unit_label": "Conquer English Vocabulary Primary 4 - 010 Exercise 010",
    "answer_file_id": "1729d0ac-2d6a-4b4d-b76d-8f57a27ffd90",
    "answer_file_path": "/Users/jarodm/Library/CloudStorage/GoogleDrive-genrong.meng@gmail.com/My Drive/DaydreamEdu/Singapore Primary English/P4/Book/Conquer English Vocabulary Primary 4/_c_Conquer English Vocabulary Primary 4 - 101 Answers.pdf",
    "answer_page_start": 1,
    "answer_page_end": 1,
    "starts_mid_page": false,
    "ends_mid_page": false,
    "answer_mapping_source": "manual_verified",
    "answer_mapping_notes": "Exercise 010 appears within answer page 1, between earlier and later exercises on the same page.",
    "question_selection": {
      "raw_text": null,
      "canonical_refs": [],
      "section_hint": null
    }
  },
  "summary": {
    "total_marks": 10,
    "earned_marks": 8,
    "percentage": 80.0,
    "overall_assessment": "Emma showed good understanding of this nature-themed vocabulary set and answered 8 of the 10 items correctly. The two misses were `nutrients` in Q4 and `ascended` in Q6, so a short review of environmental science vocabulary and mountain-climbing verbs would be useful.",
    "human_note": null
  },
  "question_results": [
    {
      "result_id": "Q1",
      "max_marks": 1,
      "earned_marks": 1,
      "outcome": "correct",
      "student_answer": "(2)",
      "correct_answer": "(2)",
      "scoring_status": "counted",
      "feedback": null,
      "error_tags": [],
      "skill_tags": [
        "Vocabulary",
        "water movement",
        "cascading down the rocks"
      ],
      "diagnosis": {
        "mistake_type": null,
        "reasoning": null,
        "confidence": null
      },
      "human_note": null
    },
    {
      "result_id": "Q2",
      "max_marks": 1,
      "earned_marks": 1,
      "outcome": "correct",
      "student_answer": "(2)",
      "correct_answer": "(2)",
      "scoring_status": "counted",
      "feedback": null,
      "error_tags": [],
      "skill_tags": [
        "Vocabulary",
        "weather relief",
        "rain was a relief"
      ],
      "diagnosis": {
        "mistake_type": null,
        "reasoning": null,
        "confidence": null
      },
      "human_note": null
    },
    {
      "result_id": "Q3",
      "max_marks": 1,
      "earned_marks": 1,
      "outcome": "correct",
      "student_answer": "(2)",
      "correct_answer": "(2)",
      "scoring_status": "counted",
      "feedback": null,
      "error_tags": [],
      "skill_tags": [
        "Vocabulary",
        "light effects",
        "glistening ring"
      ],
      "diagnosis": {
        "mistake_type": null,
        "reasoning": null,
        "confidence": null
      },
      "human_note": null
    },
    {
      "result_id": "Q4",
      "max_marks": 1,
      "earned_marks": 0,
      "outcome": "wrong",
      "student_answer": "(3)",
      "correct_answer": "(4)",
      "scoring_status": "counted",
      "feedback": null,
      "error_tags": [],
      "skill_tags": [
        "Vocabulary",
        "plant growth",
        "nutrients in soil"
      ],
      "diagnosis": {
        "mistake_type": null,
        "reasoning": null,
        "confidence": null
      },
      "human_note": null
    },
    {
      "result_id": "Q5",
      "max_marks": 1,
      "earned_marks": 1,
      "outcome": "correct",
      "student_answer": "(1)",
      "correct_answer": "(1)",
      "scoring_status": "counted",
      "feedback": null,
      "error_tags": [],
      "skill_tags": [
        "Vocabulary",
        "moisture",
        "dew"
      ],
      "diagnosis": {
        "mistake_type": null,
        "reasoning": null,
        "confidence": null
      },
      "human_note": null
    },
    {
      "result_id": "Q6",
      "max_marks": 1,
      "earned_marks": 0,
      "outcome": "wrong",
      "student_answer": "(4)",
      "correct_answer": "(1)",
      "scoring_status": "counted",
      "feedback": null,
      "error_tags": [],
      "skill_tags": [
        "Vocabulary",
        "mountain climbing",
        "ascended the mountain"
      ],
      "diagnosis": {
        "mistake_type": null,
        "reasoning": null,
        "confidence": null
      },
      "human_note": null
    },
    {
      "result_id": "Q7",
      "max_marks": 1,
      "earned_marks": 1,
      "outcome": "correct",
      "student_answer": "(3)",
      "correct_answer": "(3)",
      "scoring_status": "counted",
      "feedback": null,
      "error_tags": [],
      "skill_tags": [
        "Vocabulary",
        "natural disasters",
        "landslide"
      ],
      "diagnosis": {
        "mistake_type": null,
        "reasoning": null,
        "confidence": null
      },
      "human_note": null
    },
    {
      "result_id": "Q8",
      "max_marks": 1,
      "earned_marks": 1,
      "outcome": "correct",
      "student_answer": "(1)",
      "correct_answer": "(1)",
      "scoring_status": "counted",
      "feedback": null,
      "error_tags": [],
      "skill_tags": [
        "Vocabulary",
        "disaster statistics",
        "death toll"
      ],
      "diagnosis": {
        "mistake_type": null,
        "reasoning": null,
        "confidence": null
      },
      "human_note": null
    },
    {
      "result_id": "Q9",
      "max_marks": 1,
      "earned_marks": 1,
      "outcome": "correct",
      "student_answer": "(3)",
      "correct_answer": "(3)",
      "scoring_status": "counted",
      "feedback": null,
      "error_tags": [],
      "skill_tags": [
        "Vocabulary",
        "forest density",
        "sunlight could hardly penetrate"
      ],
      "diagnosis": {
        "mistake_type": null,
        "reasoning": null,
        "confidence": null
      },
      "human_note": null
    },
    {
      "result_id": "Q10",
      "max_marks": 1,
      "earned_marks": 1,
      "outcome": "correct",
      "student_answer": "(1)",
      "correct_answer": "(1)",
      "scoring_status": "counted",
      "feedback": null,
      "error_tags": [],
      "skill_tags": [
        "Vocabulary",
        "emergency safety",
        "evacuated from their homes"
      ],
      "diagnosis": {
        "mistake_type": null,
        "reasoning": null,
        "confidence": null
      },
      "human_note": null
    }
  ],
  "review_meta": {
    "updated_at": null,
    "updated_by": null
  },
  "generation": {
    "produced_by": "migrate_learning_reports",
    "mode": "migration_from_legacy_markdown",
    "notes": "Migrated from legacy markdown learning report."
  }
}
